{
  "$schema": "http://json-schema.org/draft-07/schema#",
  "title": "Video record v1",
  "type": "object",
  "additionalProperties": false,
  "required": ["schemaVersion", "id", "title", "speakerName", "createdAt", "sources", "video", "transcript", "analysis"],
  "properties": {
    "schemaVersion": { "const": "1.0" },
    "id": { "type": "string", "pattern": "^(youtube-|video-)[A-Za-z0-9_-]{1,80}$" },
    "title": { "type": "string", "minLength": 1, "maxLength": 300 },
    "speakerName": { "type": "string", "minLength": 1, "maxLength": 120 },
    "createdAt": { "type": "string", "pattern": "^\\d{4}-\\d{2}-\\d{2}T\\d{2}:\\d{2}:\\d{2}\\.\\d{3}Z$" },
    "sources": {
      "type": "array", "minItems": 1, "maxItems": 20,
      "items": {
        "type": "object", "additionalProperties": false, "required": ["kind", "reference"],
        "properties": {
          "kind": { "enum": ["url", "upload"] },
          "reference": { "type": "string", "minLength": 1, "maxLength": 2048 }
        }
      }
    },
    "video": {
      "anyOf": [
        { "type": "null" },
        {
          "type": "object", "additionalProperties": false, "required": ["file", "originalName", "mimeType", "bytes", "sha256"],
          "properties": {
            "file": { "enum": ["video.mp4", "video.webm", "video.mov"] },
            "originalName": { "type": "string", "minLength": 1, "maxLength": 255 },
            "mimeType": { "enum": ["video/mp4", "video/webm", "video/quicktime"] },
            "bytes": { "type": "integer", "minimum": 1, "maximum": 104857600 },
            "sha256": { "type": "string", "pattern": "^[a-f0-9]{64}$" }
          }
        }
      ]
    },
    "transcript": {
      "type": "object", "additionalProperties": false,
      "required": ["file", "sha256", "provenance", "audioVerified", "cues"],
      "properties": {
        "file": { "const": "transcript.txt" },
        "sha256": { "type": "string", "pattern": "^[a-f0-9]{64}$" },
        "provenance": { "const": "user-supplied" },
        "audioVerified": { "const": false },
        "cues": {
          "type": "array", "minItems": 1, "maxItems": 10000,
          "items": {
            "type": "object", "additionalProperties": false, "required": ["id", "startSeconds", "text"],
            "properties": {
              "id": { "type": "integer", "minimum": 1 },
              "startSeconds": { "type": ["integer", "null"], "minimum": 0 },
              "text": { "type": "string", "minLength": 1, "maxLength": 100000 }
            }
          }
        }
      }
    },
    "analysis": {
      "type": "object", "additionalProperties": false, "required": ["remarks", "summary", "limitations"],
      "properties": {
        "remarks": {
          "type": "array", "minItems": 1, "maxItems": 10000,
          "items": {
            "type": "object", "additionalProperties": false, "required": ["cueId", "quote", "uncertain", "note"],
            "properties": {
              "cueId": { "type": "integer", "minimum": 1 },
              "quote": { "type": "string", "minLength": 1, "maxLength": 100000 },
              "uncertain": { "type": "boolean" },
              "note": { "type": "string", "maxLength": 1000 }
            }
          }
        },
        "summary": {
          "type": "array", "minItems": 1, "maxItems": 100,
          "items": {
            "type": "object", "additionalProperties": false, "required": ["title", "text", "remarkIndexes"],
            "properties": {
              "title": { "type": "string", "minLength": 1, "maxLength": 200 },
              "text": { "type": "string", "minLength": 1, "maxLength": 4000 },
              "remarkIndexes": {
                "type": "array", "minItems": 1, "maxItems": 10000, "uniqueItems": true,
                "items": { "type": "integer", "minimum": 0 }
              }
            }
          }
        },
        "limitations": { "type": "array", "maxItems": 100, "items": { "type": "string", "minLength": 1, "maxLength": 2000 } }
      }
    }
  }
}
