{
  "schemaVersion": "1.0",
  "id": "youtube-xX9c2Vg2Z00",
  "title": "Andy Burnham and Kemi Badenoch face off in first ever PMQs clash",
  "speakerName": "Andy Burnham",
  "createdAt": "2026-10-24T11:36:57.544Z",
  "sources": [
    {
      "kind": "url",
      "reference": "https://www.youtube.com/watch?v=xX9c2Vg2Z00"
    }
  ],
  "video": null,
  "transcript": {
    "file": "transcript.txt",
    "sha256": "08d525350d8375ed44d3c4ebe1e1ef6c407cf98518354d2e88c325a5d972ee25",
    "provenance": "user-supplied",
    "audioVerified": false,
    "cues": [
      {
        "id": 1,
        "startSeconds": 3,
        "text": "Thank you, Mr. Speaker. And can I uh congratulate the prime minister on his stamina 3 hours yesterday."
      },
      {
        "id": 2,
        "startSeconds": 14,
        "text": "Yesterday he faced 125 questions from MPs across the house."
      },
      {
        "id": 3,
        "startSeconds": 22,
        "text": "Of course, Labour and the Lib Dems just wanted more government spending as taxpayers money. But can he name a"
      },
      {
        "id": 4,
        "startSeconds": 29,
        "text": "single spending request? To which he answered no. Prime Minister."
      },
      {
        "id": 5,
        "startSeconds": 35,
        "text": "Well, what I can say uh to the right honorable lady is I was quite clear in my uh in my"
      },
      {
        "id": 6,
        "startSeconds": 45,
        "text": "statement uh about the need to get the welfare bill down. I do not want to be a"
      },
      {
        "id": 7,
        "startSeconds": 52,
        "text": "prime minister that sees a situation where we have so many people in their 20s not in education, employment or"
      },
      {
        "id": 8,
        "startSeconds": 60,
        "text": "training. I can't defend that. And I want to change that by giving more support to young people so that we start"
      },
      {
        "id": 9,
        "startSeconds": 67,
        "text": "investing in their success, Mr. Speaker, rather than paying for failure as we have done for many years under"
      },
      {
        "id": 10,
        "startSeconds": 75,
        "text": "successive governments. Now, this seems to me, Mr. speaker to be one area where we can both engage in problem solving rather than point scoring. And I hope"
      },
      {
        "id": 11,
        "startSeconds": 84,
        "text": "the right honorable lady will take up my offer on that point."
      },
      {
        "id": 12,
        "startSeconds": 89,
        "text": "Not Mr. Speaker, he avoided the question. He did not say no to a single spending request. And personally, I"
      },
      {
        "id": 13,
        "startSeconds": 96,
        "text": "think it's delightful that he wants to make everyone happy, but a prime minister needs to be a leader, not a people pleaser. He's talking he's"
      },
      {
        "id": 14,
        "startSeconds": 104,
        "text": "talking about working together on welfare. I already made that offer, but that does mean cuts. He wants to bring the welfare bill down by spending more"
      },
      {
        "id": 15,
        "startSeconds": 112,
        "text": "money. Yesterday, the prime minister told the House that his summer of promises would be paid for by rep"
      },
      {
        "id": 16,
        "startSeconds": 119,
        "text": "prioritizing within government. So, what exactly has he cut?"
      },
      {
        "id": 17,
        "startSeconds": 126,
        "text": "Well, in terms of what has he cut?"
      },
      {
        "id": 18,
        "startSeconds": 131,
        "text": "Tax is the simple answer to that question."
      },
      {
        "id": 19,
        "startSeconds": 140,
        "text": "Mr. Speaker, within days of taking office, I indicated that we would remove VAT off electricity bills. And that, Mr."
      },
      {
        "id": 20,
        "startSeconds": 151,
        "text": "Speaker, will help people with the cost of living. And then days later, with the support of my right honorable friend,"
      },
      {
        "id": 21,
        "startSeconds": 159,
        "text": "the chancellor, we said that there would be a cut in business rates for pubs, social clubs, live music venues."
      },
      {
        "id": 22,
        "startSeconds": 168,
        "text": "So, this government lowering the cost of living, lowering the cost of business and that is what we will continue uh to"
      },
      {
        "id": 23,
        "startSeconds": 176,
        "text": "do. And can I say to uh the right honorable lady, it has to be fully funded and those commitments are fully"
      },
      {
        "id": 24,
        "startSeconds": 183,
        "text": "funded. And we made a decision early to be clear about our priorities. Digital"
      },
      {
        "id": 25,
        "startSeconds": 190,
        "text": "ID is not a priority uh for me or for this government. We reallocated the funding and we made those commitments as a result."
      },
      {
        "id": 26,
        "startSeconds": 202,
        "text": "M Mr. Speaker, I asked what he cut. He says tax cuts. He hasn't said where the money is coming from. He talks about digital ID. Yeah, I know. He said"
      },
      {
        "id": 27,
        "startSeconds": 211,
        "text": "digital ID, but the the chief secretary to the former prime minister said that there was no money allocated for digital"
      },
      {
        "id": 28,
        "startSeconds": 218,
        "text": "ID. You can't cut something that never existed in the first place. Mr. Speaker, Lord O'Neal, a close friend of the prime"
      },
      {
        "id": 29,
        "startSeconds": 226,
        "text": "minister, said yesterday's statement in the Commons was the last thing investors wanted to hear. Lord O'Neal is a serious"
      },
      {
        "id": 30,
        "startSeconds": 234,
        "text": "economist. He knows what he's talking about. And sure enough, yesterday the cost of government borrowing rose to its"
      },
      {
        "id": 31,
        "startSeconds": 241,
        "text": "highest in 18 years. How does he plan to tackle the government's rising debt costs?"
      },
      {
        "id": 32,
        "startSeconds": 250,
        "text": "Well, can I uh say to my uh to the honorable lady um right honorable lady, I've worked with Jim O'Neal for 10"
      },
      {
        "id": 33,
        "startSeconds": 258,
        "text": "years. Jim O'Neal always gives me candid advice. We don't always agree, but he and I work together to turn Greater"
      },
      {
        "id": 34,
        "startSeconds": 268,
        "text": "Manchester from a former industrial heartland to the fastest growing city region in"
      },
      {
        "id": 35,
        "startSeconds": 276,
        "text": "the country. They complain, Mr. Speaker, but where are their ideas about growth?"
      },
      {
        "id": 36,
        "startSeconds": 282,
        "text": "When they were in when they were in government, we saw 14 years of stagnant"
      },
      {
        "id": 37,
        "startSeconds": 290,
        "text": "growth. We saw 14 years of debt rising as a percentage of GDP. I would say to"
      },
      {
        "id": 38,
        "startSeconds": 299,
        "text": "her that the turbulence on global markets are because of that exposure that they left behind. We are turning"
      },
      {
        "id": 39,
        "startSeconds": 307,
        "text": "that corner. Mr. Speaker, in the first half of this year, we've had the fastest growth in the G7. Borrowing fell to its"
      },
      {
        "id": 40,
        "startSeconds": 317,
        "text": "lowest level in six years. is we're cutting the deficit faster than any other G7 country. I say to the party"
      },
      {
        "id": 41,
        "startSeconds": 324,
        "text": "opposite, particularly to the right honorable lady, that is problem solving rather than point scoring."
      },
      {
        "id": 42,
        "startSeconds": 333,
        "text": "Mr. Speaker, I don't know what any of that has to do with tackling the cost of increasing debt. Mr. Speaker, uh collaborating with collaborating with"
      },
      {
        "id": 43,
        "startSeconds": 340,
        "text": "Jim O'Neal is not how we're going to get the desk debt cost down. And he said yesterday that the markets would be worried. The markets are clearly"
      },
      {
        "id": 44,
        "startSeconds": 348,
        "text": "worried. So, will he be honest and tell us? Is he preparing to raise taxes again? Yes or no?"
      },
      {
        "id": 45,
        "startSeconds": 357,
        "text": "Can I say to the right lady, I've already indicated my first moves were to cut tax. But he and I took a deliberate"
      },
      {
        "id": 46,
        "startSeconds": 367,
        "text": "decision to set an early date for the budget so that we reduced the period for prolonged uh speculation of the kind"
      },
      {
        "id": 47,
        "startSeconds": 375,
        "text": "that she is wanting us to indulge in today. But can I also say to her and indeed to the whole of her new shadow"
      },
      {
        "id": 48,
        "startSeconds": 384,
        "text": "cabinet, the majority of whom were part of a government that lasted for 49 days."
      },
      {
        "id": 49,
        "startSeconds": 394,
        "text": "A government, a short-lived government that crashed confidence in the economy, hammered people's mortgages."
      },
      {
        "id": 50,
        "startSeconds": 406,
        "text": "She took a decision at the weekend."
      },
      {
        "id": 51,
        "startSeconds": 409,
        "text": "She removed she removed a shadow chancellor who said that the truss mini"
      },
      {
        "id": 52,
        "startSeconds": 415,